"Exhibit P-40, Budget Line Item Justification: PB 2022 Army",,,,,,,,,,,,Date: May 2021,,
"Appropriation / Budget Activity / Budget Sub Activity: 2032A: Missile Procurement, Army / BA 02: Other Missiles / BSA 10: Surface-to-Air Missile System",,,,,,,P-1 Line Item Number / Title: 8260C53101 / MSE Missile,,,,,,,
"ID Code (A=Service Ready, B=Not Service Ready):",,,Program Elements for Code B Items: N/A,,,,,,,"Other Related Program Elements: 0604865A, 0603869A, 0604869A, 0605456A",,,,
Line Item MDAP/MAIS Code: 492,,,,,,,,,,,,,,
Exhibits Schedule,,,,,,Prior Years,,FY 2020,FY 2021,,FY 2022 Base,,FY 2022 OCO,FY 2022 Total
Exhibit Type,Title*,Subexhibits,,ID CD,MDAP/ MAIS Code,Quantity / Total Cost (Each) / ($ M),,Quantity / Total Cost (Each) / ($ M),Quantity / Total Cost (Each) / ($ M),,Quantity / Total Cost (Each) / ($ M),,Quantity / Total Cost (Each) / ($ M),Quantity / Total Cost (Each) / ($ M)
P-5,C53101 / MSE Missile,,,,,"1,278 / 5,223.015",,156 / 702.437,177 / 678.148,,180 / 776.696,,- / -,180 / 776.696
P-40,Total Gross/Weapon System Cost,,,,,"1,278 / 5,223.015",,156 / 702.437,177 / 678.148,,180 / 776.696,,- / -,180 / 776.696
*Title represents 1) the Number / Title for Items; 2) the Number / Title [DODIC] for Ammunition; and/or 3) the Number / Title (Modification Type) for Modifications.,,,,,,,,,,,,,,
Note: Totals in this Exhibit P-40 set may not be exact or sum exactly due to rounding.,,,,,,,,,,,,,,
"Justification: FY 2022 procurement dollars in the amount of $776.696 million support the production of 180 Missile Segment Enhancement (MSE) missiles, 25 Launcher Mod Kits (LMK), Missile Round Trainers (MRT), Empty Round Trainers (ERT), Field Surveillance Program (FSP), supporting equipment, ancillary missile items, PAC-3 Missile Support Center (P3MSC), Obsolescence, System Engineering/Program Management (SE/ PM), and Government/Software Engineering. Army Acquisition Objective (AAO) is 3376. *Unit prices reflect an assessed yearly Foreign Military Sales (FMS) procurement of PAC-3 missile variants. In the event FMS procurements do not occur at this level, the budgeted missile unit price may not be achievable. **The Army intends to convert any price advantage created through contract negotiations, other service procurement, and/or foreign military sales to increase the Army procurement MSE missiles. ***Transitioned from Fixed Price Incentive (Firm Target) (FPIF) to Firm Fixed Price (FFP) in FY21 PAC-3 Production contract.",,,,,,,,,,,,,,
